{
  "id": "R-ORM-ENTITY-NO-PK",
  "version": "1.0.0",
  "title": "Entity without a primary key column",
  "feature": "orm.entityNoPrimaryKey",
  "appliesTo": ["class"],
  "principles": ["marcus.judgment"],
  "dimensions": ["robustness", "decision-evidence"],
  "trigger": {
    "all": [{ "fact": "orm.entityNoPrimaryKey", "op": "!=", "value": "" }]
  },
  "requiredEvidence": ["orm.entityNoPrimaryKey"],
  "severity": { "base": "high" },
  "confidence": { "base": 0.8, "capBy": "certainty" },
  "message": {
    "en": "ORM entity has no primary key column.",
    "de": "ORM-Entity hat keine Primary-Key-Spalte."
  },
  "rationale": {
    "en": "A persisted entity needs a stable identity. Without a primary column the ORM rejects the entity at startup (TypeORM, Doctrine), and even where it loads, updates and relations have no reliable key to target — the identity decision was never made explicit (marcus.judgment).",
    "de": "Eine persistierte Entity braucht eine stabile Identität. Ohne Primary-Spalte weist das ORM die Entity beim Start ab (TypeORM, Doctrine), und selbst wenn sie lädt, haben Updates und Relationen keinen verlässlichen Schlüssel — die Identitätsentscheidung wurde nie explizit getroffen (marcus.judgment)."
  },
  "remediation": {
    "suggestion": {
      "en": "Add a primary key: @PrimaryGeneratedColumn()/@PrimaryColumn()/@Column({primary: true}) in TypeORM, or #[ORM\\Id] in Doctrine.",
      "de": "Einen Primärschlüssel ergänzen: @PrimaryGeneratedColumn()/@PrimaryColumn()/@Column({primary: true}) in TypeORM, oder #[ORM\\Id] in Doctrine."
    },
    "drawbacks": {
      "en": "None of note; a primary key is a baseline requirement for a persisted entity.",
      "de": "Keine nennenswerten; ein Primärschlüssel ist Grundvoraussetzung für eine persistierte Entity."
    }
  },
  "missingContext": [
    {
      "en": "A key inherited from a base class is not seen here; entities that extend a base are therefore not flagged.",
      "de": "Ein aus einer Basisklasse geerbter Schlüssel ist hier nicht sichtbar; Entities mit extends werden daher nicht gemeldet."
    }
  ],
  "tests": "test/Rules.test.ts"
}
